idx	score	sentence1	sentence2
766	1.0318511724472046	A man is riding a motorcycle.	A woman is riding a horse.
767	2.839364767074585	The Chelsea defender Marcel Desailly has been the latest to speak out.	Marcel Desailly  the France captain and Chelsea defender  believes the latter is true.
768	1.9967803955078125	You got it right.	Yes you got it.
769	0.20040364563465118	A man reels in a fish.	A woman is pouring oil in a bowl.
770	2.203843832015991	Police official S.K. Tonapi told Reuters at least 40 people had been killed and more than 100 wounded.	State interior ministry spokesman Vasant Pitke told Reuters that at least 42 people had been killed and 112 injured.
771	5.011375427246094	A man steers a blue boat past brightly colored houses.	a man driving a blue boat passes by some colorful houses.
772	1.147205114364624	The Nasdaq Composite Index rose 19.67  or 1.3 percent  to 1523.71  its highest since June 18.	The S&P 500 had climbed 16 percent since its March low and yesterday closed at its highest since Dec. 2.
773	2.775360345840454	That is your problem  not your supervisor's.	Work with your supervisor and your team to solve the problem.
775	2.808682441711426	Two dogs are running through the grass near a house and trees.	Two dogs are running through a green yard
776	2.3652238845825195	A kid is talking in class.	A girl is going to class.
777	0.45116227865219116	Someone is drawing.	Someone is dancing.
778	1.0675301551818848	The women are trying to sell something to the individual.	The men are trying to make some money.
779	3.5858778953552246	A young Asian girl is applying eyeliner.	A girl is putting on eye makeup.
780	2.545583724975586	I'd say it primarily depends on two things:	I'd say it depends what conditions you have.
781	2.395097494125366	The dog is chasing the geese.	One dog is chasing the other.
782	3.4020144939422607	He was tracked to Atlanta where he was arrested on Tuesday night.	He was arrested in Atlanta  Georgia  on Monday night by police acting on a tip-off.
783	1.0248949527740479	The two officers are driving	Two officers are on horses.
784	3.913241147994995	Kyi  a U.N. envoy says  as Japan adds to growing international pressure by saying it will halt its hefty economic aid unless Suu Kyi is freed.	JAPAN added to growing international pressure on Burma yesterday  threatening to halt its hefty economic aid unless the military government released pro-democracy leader Aung San Suu Kyi.
785	3.402885675430298	Parrot pushing a small shopping cart.	A white bird is steering a shopping cart.
786	1.8555798530578613	It has a margin of error of plus or minus 4 percentage points.	That poll had 712 likely voters and sampling error of plus or minus 3.7 percentage points.
787	0.5695521831512451	A woman wearing large sunglasses holds newspapers in both hands.	A fat woman wearing faint blue top is blowing soap bubble.
788	3.548923969268799	PeopleSoft will commit $863 million in cash and issue 52.6 million new shares  the companies said.	The new deal would be valued at $1.75 billion  including $863 million in cash and 52.6 million PeopleSoft shares.
789	3.9998326301574707	We are expending all available resources toward the investigation  said Assistant U.S. Attorney Todd Greenberg  a counterterrorism prosecutor in Seattle.	We are aware of the situation  said Assistant US Attorney Todd Greenberg  a counter-terrorism prosecutor in Seattle.
790	3.577937602996826	A man is singing and playing a guitar.	A man is playing a guitar.
791	1.5594499111175537	You just have to base your answer on what you do know  which is what you want.	It is his job to see that you have what you need to do your job.
792	0.11295221000909805	A woman is picking a can.	A man is playing a guitar.
793	2.670262575149536	You can use it  too.	Yes  you can do it.
794	2.050402879714966	The key is you have to find something that works for you  and your goals.	You may want it  but the process given to you is what you have to work within.
795	4.075229644775391	Three goats are being rounded up by a dog.	Three goats are chased by a dog.
796	1.7425949573516846	The key thing to realize here is that it's not your job to make people do their work.	It really isn't your problem how they are going to find a qualified person to do the job.
797	3.68346905708313	Further testing is still under way  but at this stage  given the early detection  the outlook in such instances would be positive  the specialist said yesterday.	But at this stage  given the early detection  the outlook in such instances would be positive  he said.
798	2.6745543479919434	The compensation committee will prohibit securities industry directors from sitting on it.	The exchange also said its five-person compensation committee will consist only of directors from outside the securities industry.
799	4.901078701019287	people getting their dirty clothes cleaned	People are getting their clothes cleaned.
800	2.678905725479126	A New Castle County woman has become the first Delaware patient to contract the West Nile virus this year  the state's Department of Health reported.	A 62-year-old West Babylon man has contracted the West Nile virus  the first human case in Suffolk County this year  according to the county health department.
801	2.9025497436523438	The Dow Jones industrial average .DJI ended up 56.79 points  or 0.67 percent  at 8 588.36 -- its highest level since January 17.	The Dow Jones Industrial Average ($DJ: news  chart  profile) rose 56 points  or 0.7 percent  to 8 588.
802	0.1920834630727768	A man is opening a box and taking out paper.	A woman is peeling a potato.
803	3.566317081451416	A black dog stands next to materials at a construction site.	A black dog stands in the middle of a construction site.
804	0.9604158997535706	A man is speaking.	A man is cooking.
805	4.67923641204834	This is a terrible idea.	This is a bad idea.
806	2.5128161907196045	A woman is cutting onions.	A woman is cutting tofu.
807	3.4146997928619385	Electronic Data Systems Corp. Thursday said the Securities and Exchange Commission has asked the company for documents related to its large contract with the U.S. Navy.	In a regulatory filing  EDS said the SEC had asked for information related to its troubled IT outsourcing contract with the US Navy.
808	1.7215980291366577	A black and white cat and dog on a striped couch.	A black and white cat standing in front of a window.
809	1.55966317653656	two white standard poodles play with a toy in the snow	Two dogs fighting in the snow.
810	3.5927767753601074	A tan girl in a floral bikini is swimming in dark blue waters.	a little girl in a flowered bathingsuit runs through the sand at the beach
811	3.029815196990967	The House has passed prescription-drug legislation in the last two sessions  but the Senate has failed to do so.	The House has passed bills the past two Congresses  but the Senate has not.
812	4.177323818206787	An oriental lady is cutting a carrot into thin pieces.	A woman is slicing a carrot.
813	3.7219929695129395	A guy is taking off his sunglasses.	A boy is removing his sunglasses.
814	0.8881751894950867	You don't have to know.	You have no need to do anything.
815	0.9052438735961914	Dog is jumping down a ramp.	A girls is jumping in the sand.
816	4.101132869720459	People are dancing outside.	A group of people are dancing.
817	2.5324249267578125	Elderly woman sitting on red patterned couch with her arm around younger woman.	Two women sitting on couch posing for camera.
818	3.0475354194641113	From what I understand this is what you can do :	Can you do this?
819	3.617612600326538	"""The agency will """"consider as timely any tax returns or payments due"""" Aug. 15 if they are submitted by Aug. 22."""	The agency said it would consider as timely any tax returns or payments due from Friday through Aug. 22 if they are completed by Aug. 22.
820	0.1031227633357048	A woman is cutting an onion.	A horse is standing.
821	2.5067262649536133	I had the same problem as you.	I have exactly the same problem.
822	3.3131103515625	A group of people are nervous about crossing the water.	A group of people are on the water.
823	2.7938404083251953	Sometime if you really want it you might need to pay an agency to get the place for you.	You could probably get a tour agency to do it for you but it would cost you.
824	2.5215158462524414	Hope this is what you are looking for.	Is this the kind of thing you're looking for ?
825	3.0064480304718018	Both of these kids are in wonderful physical condition right now  he said during a press briefing at the hospital.	Both of these kids are in wonderful physical condition right now  said Goodrich  also director of pediatric neurosurgery at the Children's Hospital at Montefiore.
826	2.7805888652801514	A child is waking up.	A girl is waking up.
827	4.159751892089844	A woman is dancing in the rain.	A woman dances in the rain out side.
828	2.2826645374298096	Only Intel Corp.'s 0.3 percent yield was lower.	Only Intel Corp. has a lower dividend yield.
829	1.8146283626556396	A group of teenagers in red shirts are smiling.	A group of people are wearing orange shirts.
830	1.9014772176742554	I am not sure this is the right site for the question.	I am not sure this question would have made much sense to the Romans themselves.
831	3.2527379989624023	Yucaipa owned Dominick's before selling the chain to Safeway in 1998 for $2.5 billion.	Yucaipa bought Dominick's in 1995 for $693 million and sold it to Safeway for $1.8 billion in 1998.
832	4.441281318664551	It's not a good idea.	It's not just a good idea  it's an excellent idea.
833	4.845555782318115	A woman is dicing some peeled potatoes cut into thick strips.	A woman is chopping a peeled potato into slices.
834	0.2527974843978882	A small camouflaged airplane parked in the grass.	A small dog wearing a pink shirt tied to a railing.
835	1.2802817821502686	The best thing you can do is to know your stuff.	My recommendation is not to say anything  and do the best you can.
836	3.2639617919921875	Box cutters were used as a weapon by the Sept. 11  2001  hijackers and have since been banned as carry-on items.	Box cutters were the weapons used by the 19 hijackers in the Sept. 11  2001  attacks.
837	1.7994526624679565	2 Cows are in a field.	Two sheep are in a field.
838	2.8338394165039062	The consensus among Wall Street analysts was for a loss of 28 cents a share.	Analysts surveyed by First Call were expecting sales of $723 million and a loss of 28 cents a share.
840	2.2666947841644287	Q: Can I buy coverage for prescription drugs right away?	Congress has added a new benefit - an option to buy insurance coverage for prescription drugs.
841	1.0451568365097046	A woman is posing for a Christmas card.	A girl is taking a photo.
842	3.9102790355682373	The man is sitting cross legged wearing a cloak and holding a stick.	Man sitting cross legged while wearing a brown cloth and holding a wooden stick.
843	1.5308482646942139	A man is playing the drums.	A man is playing the guitar.
844	1.8855655193328857	If you are not sure how to do it  don't do it at all.	You don't  it will not work.
845	4.657014846801758	Four dogs stand in the snow.	Four dogs playing in the snow.
846	3.2094013690948486	Site Finder has been visited 65 million times since its introduction  Galvin said.	Through Sunday  Sept. 21  Site Finder has been visited over 65 million times by Internet users.
847	2.6040115356445312	It's not a good idea.	I do not think it's a good idea.
848	2.3006653785705566	"""A promotional poster  complete with countdown dial  reminds readers of the upcoming release of """"Harry Potter and the Order of the Phoenix."""""""	"""The crates are full of hardback copies of """"Harry Potter and the Order of the Phoenix."""""""
849	1.0459601879119873	A group of dark-skinned people are walking past barbed wire.	Two women are gossiping by a fence.
850	5.102197170257568	the people are running a marathon	People are running a marathon
851	2.1480178833007812	Two little girls talk on the telephone.	Two couple are talking with each other.
852	0.15588992834091187	A cat is walking around a house.	A woman is peeling potato.
853	1.8320573568344116	Graves reported from Albuquerque  Villafranca from Austin and Ratcliffe from Laredo.	Pete Slover reported from Laredo and Gromer Jeffers from Albuquerque.
854	3.7345285415649414	An elderly man works on his laptop at home.	Older gentleman sitting on couch with laptop.
855	1.3095829486846924	There are a couple of options that you could consider:	There are a lot of ways that could go poorly for you.
856	1.9700244665145874	It depends on the dish and how amenable it is at the stage you make the mistake.	It depends on the sauce and the result you want.
857	1.7333476543426514	A woman drives a golf cart.	A man riding a cart.
858	3.1513020992279053	The children are holding musical instruments.	A group of children are singing and playing instruments
859	2.638094425201416	A turtle is swimming in water.	A turtle is walking underwater.
860	3.6669185161590576	A man with a bicycle at a coffee house.	Man walking bicycle to patio of a coffee shop.
861	2.5764942169189453	The two dogs are playing in the yard.	Two dogs are playing on the grass.
862	3.2807796001434326	A man is eating a food.	A man is eating a piece of bread.
863	4.996274471282959	Three children playing on a floor with toys.	Three children sitting in floor playing with several toys.
864	5.037435531616211	A woman plays the flute.	A woman is playing the flute.
865	1.448096752166748	I would say you can do it  but it wouldn't be advised.	Personally  I would say not unless it suits you.
866	4.202772617340088	The # 2 greyhound dog is running around a track.	a muzzled greyhound dog is running around a track
867	3.350104808807373	We need to change old habits and seriously rethink business-as-usual.	"""He urged employees to """"avoid complacency"""" and to """"change old habits and seriously rethink business-as-usual."""""""
868	2.003598690032959	A man is playing guitar.	A lady is playing the guitar.
869	4.215674877166748	Authorities appealed to the public Friday to come forward and provide what could be the key to solving the sniper-style shootings that have killed three people outside area convenience stores.	Authorities looked to the public yesterday for help in solving the deadly sniper-style shootings of three people outside Charleston-area convenience stores.
870	2.9892327785491943	Diana was at her lowest ebb when she wrote the letter to Paul Burrell claiming there was a plot to kill her.	Burrell said Diana wrote a letter in October 1996 claiming there was a plot to kill her in a smash and gave it to him to keep as insurance.
871	3.8285770416259766	The panda bear lay on the logs.	A panda is lying down.
872	2.583483934402466	Local police authorities are treating the explosion as a criminal matter and nothing has been ruled out.	Acting New Haven Police Chief Francisco Ortiz said police were treating the explosion as a criminal matter.
873	1.5233502388000488	A man holding a cat.	A man holding a dog.
874	3.51739501953125	A small boy is building with some wooden blocks.	A small boy wearing a blue shirt stacks wooden blocks.
875	2.6913857460021973	A pitcher on a mound throws a baseball.	A boy in the middle of a pitch at a baseball game.
876	1.5994240045547485	I did this one time as well.	I have this habit as well.
877	3.303917407989502	The giant rock was first observed on August 24 by Lincoln Near-Earth Asteroid Research Program  based in Socorro  New Mexico.	The rock was first observed by the Lincoln Near Earth Asteroid Research Program  also known as LINEAR.
878	0.5091543197631836	A man is slicing a tomato.	A man is riding a horse.
879	3.479142189025879	U.S. forces recently apprehended some 40 suspected foreign militants near the Syrian border and are now interrogating them.	The Third Armored Cavalry Regiment recently apprehended about 40 suspected fighters near the Syrian border  officials said.
880	0.15664233267307281	A cat is playing on the floor.	A man is slicing garlic.
881	3.6492371559143066	Five men jump into a swimming pool.	A group of swimmers fall into a pool.
882	2.728332757949829	"""My answer to your question is """"Probably Not""""."""	This is a part answer to your question
883	0.5677820444107056	A woman stands in front of a building in the snow.	Two women and a baby pose in front of a dining room.
884	4.785706043243408	Three people sit at a picnic table outside of a building painted like a union jack.	Three people sit at an outdoor table in front of a building painted like the Union Jack.
885	2.803147554397583	Two cats are looking at a window.	A white cat looking out of a window.
886	2.6886074542999268	Yes  it is possible to publish a paper on model analysis.	Yes  it is hard to publish in a peer reviewed journal.
887	0.34859025478363037	People making a structure out of cards.	Two people are together and one is using a piece of clothing in a different way than intended.
888	2.2658331394195557	You just have to base your answer on what you do know  which is what you want.	It depends on what you want to do next  and where you want to do it.
889	3.6129965782165527	A dog is playing with a toy.	A dog is eating a doll.
890	3.204939365386963	Chaudhry was released 56 days later and the Fiji military installed an all-indigenous government led by Qarase  who won democratic elections in September 2001.	The Fijian military installed an all-indigenous government led by Mr Qarase  who won democratic elections in September 2001.
891	3.214212656021118	This is not a good idea.	This is probably not a good idea but I will suggest it anyhow.
892	4.551851272583008	A group of people living in the desert	A group of people in the middle of the desert.
893	1.7287826538085938	This is a great one... 	This is a difficult one.
894	4.694415092468262	Blue and red plane in mid-air flight.	a blue and red airplane while in flight.
895	3.7440266609191895	Three men sit on a bench.	two men sit on a bench.
896	1.5158207416534424	The man is exercising.	A man is doing pull-ups.
897	4.475272178649902	There is a cook preparing food.	A cook is making food.
898	2.608891010284424	A boy is very close to a girl.	A girl is close to a boy whose face is not shown.
899	1.9943385124206543	Vietnamese citizens need a visa to visit the USA.	Nepalese citizens require a visa to visit the UK.
900	2.532541275024414	He also reaffirmed his wish to resolve the North Korean nuclear crisis peacefully.	But the North Korean nuclear crisis has dominated his time in office.
901	2.793226957321167	A cat sleeping on the coach with a pillow behind it.	The cat is laying on an animal print blanket.
902	4.8012309074401855	Someone is on a blanket.	The person is making a blanket.
903	2.3392696380615234	A group of people sit at a table in an Italian restaurant.	A group of six people sitting at a table with salad served.
904	1.7992639541625977	You just have to base your answer on what you do know  which is what you want.	They can  but the way to do it depends on what you have available.
905	3.5159049034118652	Rich media doubled its share  increasing from 3% in Q2 2002 to 6% in Q2 2003.	Rich Media interactive ad formats doubled their share from 3% in second quarter of 2002  to 6% in the second quarter of 2003.
906	3.120438575744629	"""The Justice Department filed suit Thursday against the state of Mississippi for failing to end what federal officials call """"disturbing"""" abuse of juveniles and """"unconscionable"""" conditions at two state-run facilities."""	The Justice Department filed a civil rights lawsuit Thursday against the state of Mississippi  alleging abuse of juvenile offenders at two state-run facilities.
907	3.7418923377990723	A man is sitting and smoking.	A man is smoking a cigarette.
908	1.9631288051605225	A person is slicing some onions.	A woman is chopping herbs.
909	3.910926580429077	A woman is slicing some tofu.	A woman is cutting a block of tofu into small cubes.
910	3.4697186946868896	The woman in overalls paints a picture for her wall.	A woman is painting her wall white.
911	4.336452007293701	A woman mixes up vegetables.	A woman is adding ingredients to a skillet.
912	0.502680242061615	The head of a child with dark glasses is in focus.	There is a woman with a full head of hair.
913	1.343394160270691	I would say you can do it  but it wouldn't be advised.	I would say it is impossible to know  so don't risk it.
914	2.4222090244293213	Two Indian women with two Indian girls near the water.	Two Indian woman stand with two Indian girls on a beach.
915	3.6027495861053467	two cats  one brown and one white laying on a bed with a blue blanket.	Two cats  one ginger  the other white laying on a bed.
916	2.6267993450164795	I had the same problem as you.	I have just had the same problem.
917	4.152439594268799	A cat is eating some corn.	A cat is eating corn on the cob.
918	3.4512124061584473	It depends on what you want to do next  and where you want to do it.	I guess it depends on what you're going to do.
919	3.7512919902801514	"""Contrary to what PeopleSoft management would have you believe  Oracle intends to fully support PeopleSoft customers and products for many years to come."""""""	"""Ellison said that contrary to the contentions of PeopleSoft management  Oracle intends to """"fully support PeopleSoft customers and products"""" for many years to come."""
920	4.076019287109375	In the year-ago period  Pearson posted a 26 million pre-tax profit.	A year ago the firm posted a profit of 26 million pounds.
921	3.144960403442383	Advanced Micro Devices said Fujitsu Siemens Computers is offering a high-end workstation based on AMD's Opteron 200 Series.	Fujitsu Siemens Computers on Tuesday made good on a promise to offer a workstation based on Advanced Micro Devices' Opteron processor.
922	3.8160619735717773	How do you do that?	How should you do that?
923	3.072484254837036	It depends entirely on your company and your contract.	It depends on your company.
924	3.8746509552001953	The cat is licking a bottle.	A cat plays with a small bottle.
925	0.6246840953826904	A man is playing a flute.	A man is riding a scooter.
926	3.0600807666778564	This is not a good idea.	Not a good idea.
927	5.1010894775390625	A brown dog is jumping.	A brown dog is jumping
928	2.1875176429748535	Unfortunately the answer to your question is we simply do not know.	Sorry  I don't know the answer to your question.
929	4.373366832733154	Special police detained Khodorkovsky early on Saturday in the Siberian city of Novosibirsk  where his plane had made a refuelling stop.	Police detained Khodorkovsky early on Saturday when his jet made a refueling stop in the Siberian city of Novosibirsk.
930	2.734177589416504	The small dog is wearing a sweater and looking up at the camera.	A small white dog wearing a jacket looks up at the camera.
931	1.015488862991333	A man is making a bed.	A man is speaking to an audience.
932	1.1274961233139038	The man is talking.	A man is walking down stairs.
933	4.941691875457764	A woman opens a window.	A woman is looking out a window.
934	4.455633163452148	Group of people posing with two men dressed as Elvis.	A group of people standing with two other people dressed as Elvis.
935	0.5913055539131165	A steam engine and train moving toward the camera.	A white sheep on a hillside looking at the camera.
936	1.1544731855392456	People are waiting for the fireworks to start.	Three people are waiting for the rain to stop.
937	2.562688112258911	A woman puts make-up on.	A woman is putting on eyeshadow.
938	3.6697182655334473	A man is cutting pieces of butter into a mixing bowl.	Pieces of butter is added in the stand mixer.
939	4.312558650970459	A person wipes butter on a tray.	A person is buttering a tray.
940	0.34334808588027954	The woman is holding the harness that the brown and white dog is wearing.	A man and woman are looking at artwork that is on easels and clipped to a fencing wall.
941	2.4053797721862793	You don't need to know everything.	You don't have to know.
942	1.8363420963287354	A woman is cutting an onion.	A woman is cleaning a garden.
943	4.783299446105957	A boy is playing a key-board.	A little boy is playing a keyboard.
944	3.3227438926696777	A group of teenagers jumping and having a good time.	A group of kids having a good time.
945	1.410381555557251	A black and white photo of a love seat.	Black and white photo of couch with purse at one end.
946	4.208742618560791	A man wearing black formal wear & a black top hat is riding a white show horse.	A man with a top hat riding a white horse.
947	1.2529901266098022	The person is wearing a fedora.	A man is wearing a uniform.
948	3.4779930114746094	A maintenance guy is repairing a net on a tennis court.	A man removing a tennis net.
949	3.902559518814087	How do you do that?	How to do that?
950	1.441361904144287	On Monday  the Dow declined 5.25  or 0.1 percent  at 8 983.80  having shed 2.3 percent last week.	In early trading  the Dow Jones industrial average was down 39.94  or 0.4 percent  at 8 945.50  having slipped 3.61 points Monday.
951	1.3927028179168701	A cat laying on a red cushion looking at the camera.	A tan dog lying on a moggie bed looking up at the camera.
952	4.025290489196777	A man is laughing with a woman	A man and a woman laughing.
953	2.2248549461364746	There are a few possible reasons.	There are a few reasons that paint wrinkles.
954	3.110856056213379	Martin  58  will be freed today after serving two thirds of his five-year sentence for the manslaughter of 16-year-old Fred Barras.	Martin served two thirds of a five-year sentence for the manslaughter of Barras and for wounding Fearon.
955	3.6092987060546875	A girl in a riding hat on a horse.	A girl riding a brown horse.
956	4.094710826873779	A monkey is playing drums.	A gorilla plays the drums.
957	1.8407306671142578	A person is on a baseball team.	A person is playing basketball on a team.
958	0.1631573587656021	A man and a woman watch two dogs.	A man in a maroon bathing suit swings on a rope on a lake.
