idx	score	sentence1	sentence2
188	3.1560449600219727	A group of people are dancing.	Women are dancing outside.
189	2.0030336380004883	It's not a good idea.	It's a good idea to do both.
190	2.6059961318969727	He is about to run into the boat	The man is getting his boat clean to take it out on the water.
191	4.745506286621094	A polar bear is running towards a group of walruses.	A polar bear is chasing a group of walruses.
192	0.9300270676612854	You shouldn't feel any obligation at all.	You don't need sauce at all.
193	1.6668314933776855	Six children are cleaning a room.	Two male children cleaning up leaves in a parking lot.
194	2.88450288772583	Researchers found the fossils in a semidesert area of Venezuela  about 250 miles west of Caracas.	Phoberomys' skeleton was unearthed 250 miles west of Caracas  Venezuela.
195	4.525716781616211	A few more point to think about:	A few things to think about:
196	4.776362895965576	A person is slicing some garlic.	A person is dicing a clove of garlic with a knife.
197	3.179316759109497	A skunk is looking here and there.	A skunk looks at the camera.
198	0.47401273250579834	A man is praying.	A man is dancing.
199	1.3544607162475586	You don't have to worry.	You don't have to do anything to season it.
200	0.3710891604423523	A young woman is riding a Bay hose in a dirt riding-ring.	A man is staring at a horse with a white mane.
201	3.6568756103515625	Home office space with bright green walls and artwork.	An office with multiple desks and green walls.
202	1.5221974849700928	A man is playing piano.	A man is playing a violin.
203	3.880995988845825	The new sensor -- dubbed CANARY for ''cellular analysis and notification of antigen risks and yields'' -- hijacks this natural process with two important changes.	The team has named the sensor Canary  for cellular analysis and notification of antigen risks and yields.
204	2.384883403778076	You can use it  too.	You can still use it for practice.
205	2.1135191917419434	It depends on what you want to do next  and where you want to do it.	You need to pick how and where you want to place your foot and do it.
206	3.435363292694092	Frank Quattrone  the former Credit Suisse First Boston technology investment-banking guru  reportedly pleaded not guilty Tuesday to charges of obstruction of justice and witness tampering.	NEW YORK -(Dow Jones)- Former star investment banker Frank Quattrone pleaded not guilty Tuesday to criminal charges of obstruction of justice and witness tampering.
207	0.5505390763282776	The kids are at the theater watching a movie.	it is picture day for the boys
208	1.6844521760940552	You just have to base your answer on what you do know  which is what you want.	You have to do what is right for you.
209	2.9702508449554443	I've had this same problem.	I had this same situation.
210	4.643841743469238	Wal-Mart  Kohl's Corp.  Family Dollar Stores Inc.  and Big Lots Inc. were among the merchants posting May sales that fell below Wall Street's modest expectations.	Wal- Mart  Kohl's Corp.  Family Dollar Stores Inc.  and Big Lots Inc. posted May sales that fell below Wall Street's modest expectations.
211	2.7895467281341553	It depends on what you want to do next  and where you want to do it.	It depends on what you want to say/imply.
212	2.9222586154937744	I'm afraid we are out of luck in this one.	I think this is one of those things where you are just out of luck.
213	3.7482736110687256	A boy climbs a forest hill.	A boy is climbing a hill.
214	0.2777481973171234	A little girl in an orange striped outfit is airborne whilst bouncing on a bed.	A dog in a red shirt is chasing a squirrel through the glass.
215	2.01829195022583	The woman is styling her hair.	The woman is slicing herbs.
216	0.9357726573944092	It's pretty much up to you.	It's much better to ask.
217	4.311119079589844	Under Mexican law  bounty hunting is considered a form of kidnapping.	Bounty hunting is illegal in Mexico  and the bounty hunter was charged with kidnapping.
218	3.7103471755981445	The cat is drinking milk.	A white cat is licking and drinking milk kept on a plate.
219	2.68870210647583	It really doesn't matter.	It doesn't matter unless it is really far off.
220	3.4015023708343506	The government did not identify the taikonauts — a term coined from ‘‘taikong ’’ the Chinese word for space — who would travel on the second mission.	The government did not identify the taikonauts -- a term coined from taikong  the Chinese word for space.
221	4.867594242095947	I think it's fine to ask this question.	I think it is okay to ask the question.
222	3.114138603210449	You can do it  too.	Yes  you can do it.
223	4.8229851722717285	A Philips flat-screen TV is shown with its two remote controls.	A Phillips flat screen TV with two remote controls.
224	3.442767858505249	Zombies parading around eating brains.	The zombies are eating flesh together.
225	1.4802560806274414	A group of kids are having a jumping contest.	A group of kids are having a sleepover.
226	1.143256425857544	You need to read a lot to know what you like and what you don't.	You should tell a good story and sometimes you have to tweak reality/history to do so.
227	2.0018997192382812	A little girl is riding a toy tricycle on springs.	A little girl is playing on a toy outdoors.
228	2.32377552986145	Three dogs running in the dirt.	The yellow dog is running on the dirt road.
229	3.5873026847839355	On July 22  Moore announced he would appeal the case directly to the U.S. Supreme Court.	Moore of Alabama says he will appeal his case to the nation's highest court.
230	1.6882696151733398	Results from No. 2 U.S. soft drink maker PepsiCo Inc. (nyse: PEP - news - people) were likely to be in the spotlight.	Wall Street was also waiting for aluminum maker Alcoa Inc. (nyse: PEP - news - people) to report earnings after the close.
231	1.9350950717926025	The tech-laced Nasdaq Composite Index gained 2.90 points  or 0.18 percent  to 1 606.87.	At 12:10 p.m. EDT  Canada's benchmark S&P/TSX composite index was up 6.87 points or 0.1 per cent to 6 979.29.
232	0.9806661009788513	A man is hitting a boy with flower vase.	A man is cutting a mat.
233	3.1325933933258057	One  Fort Carson-based Sgt. Ernest Bucklew  33  had been on his way home to attend his mother's funeral in Pennsylvania.	Sgt. Ernest Bucklew  33  was coming home from Iraq to bury his mother in Pennsylvania.
234	0.40880095958709717	A man is playing a guitar.	A man is eating pasta.
235	0.962879478931427	A man in a wet suit is throwing a baby wearing a wet suit up into the air.	A man in a white print shirt and a woman in a black dress dancing.
236	2.9940237998962402	Waksal has pleaded guilty to securities fraud and is to be sentenced next week.	Waksal pleaded guilty to insider trading charges last year  and he is scheduled to be sentenced June 10.
237	5.057511806488037	One person wields an umbrella.	One person is holding an umbrella.
238	4.2404632568359375	One witness told Anatolian he saw the plane on fire while it was still in the air.	One witness told the Anatolian news agency he saw the plane on fire in mid-air.
239	3.1315383911132812	The new analysis found that 32 of the 16 608 participants developed ovarian cancer during about 5 years of follow-up.	The new analysis found that 32 of 16 608 participants developed ovarian cancer in about 5 1/2 years of follow-up  including 20 women taking hormones.
240	3.195218086242676	The bishop told police he thought he had hit a dog or a cat or that someone had thrown a rock at his vehicle.	Bishop O'Brien  aged 67  had told police he thought he had hit a dog or cat.
241	2.8334803581237793	There are a few things I think you should do.	There are a few minimally-effective things you can do at the personal level.
242	4.231711387634277	A man and a woman is kissing each other.	A man and a woman are hugging and kissing each other.
243	3.491429567337036	Looking to buy the latest Harry Potter?	Harry Potter's latest wizard trick?
244	2.8182084560394287	Several people on motorcycles in a market square.	People on motorbikes in a city street.
245	4.010157585144043	Unfortunately  this question cannot be answered in its full generality.	This cannot be answered in general.
246	3.4133524894714355	You can use it  too.	You can do it  too.
247	3.028463840484619	Two black and white dogs at the bottom of stairs.	A dog is lying at the bottom of a staircase next to another standing dog.
248	0.568401038646698	A pole is behind a person that is playing peekaboo with a child.	There is a child with a ball
249	1.6517030000686646	Yes  it's probably a good idea to renew your passport.	It's a good idea.
250	1.9704294204711914	A man is working on his farm.	An old guy is working on his farm and a cow kicks him.
251	3.4758543968200684	Bolivia's army fought to stop columns of protesters from streaming into the food-starved capital on Wednesday as a popular uprising against the president spread.	Bolivia's army fought to stop a column of dynamite-wielding miners from streaming into the besieged capital on Wednesday  leaving two dead as a popular uprising against the President spread.
252	1.290878176689148	The technology-laced Nasdaq Composite Index .IXIC shed 15 points  or 0.98 percent  to 1 492.	The broader Standard & Poor's 500 Index <.SPX> edged down 9 points  or 0.98 percent  to 921.
253	2.890983819961548	"""They said they had concluded that the film failed """"to present a balanced portrayal"""" of the Reagans."""	"""CBS said the show """"does not present a balanced portrayal of the Reagans for CBS and its audience."""
254	4.341797828674316	It''s absurd  Funny Cide's trainer Barclay Tagg said.	"""Meanwhile  Funny Cide's trainer  Barclay Tagg  called the allegations """"ridiculous."""""""
255	1.1360135078430176	You have to decide what you want to get out of this.	You're probably going to have to read various blogs to get all the information you want.
256	2.5242228507995605	National Breast Cancer Centre chief executive Professor Christine Ewan said it was too early to quantify the risk to women.	National Breast Cancer Centre head Professor Christine Ewan said there was no need for panic.
257	2.3830628395080566	A man is putting garlic on some bread slices.	A man is sprinkling seasoning on several split and buttered loaves of bread.
258	4.970328330993652	The Bush administration blames Hussein loyalists and foreign Muslim militants who have entered Iraq to fight U.S. troops for the wave of bombings and guerrilla attacks.	The Bush administration blames the wave of bombings and guerrilla attacks on Saddam loyalists and foreign Muslim militants who have entered Iraq to fight U.S. troops.
259	1.2178603410720825	A man is driving a car.	A man is riding a horse.
260	4.579601764678955	The next court session will be when the three-judge tribunal announces its verdict in mid-February.	The court's three-judge tribunal was expected to give its verdict next February.
261	1.5456693172454834	Two dogs play in the grass.	Two dogs playing in the snow.
262	3.567747116088867	A woman riding a brown horse.	A girl riding a brown horse.
263	0.6870539784431458	The train heads down the tracks and along the hedge.	a dog on the floor of a patio looks at a cat on the fence.
264	2.392756462097168	The best thing you can do is to know your stuff.	The best thing you can do is find something else interesting to do while you wait on hold.
265	3.83034348487854	Taylor's aides warn an abrupt departure could trigger more chaos  a view shared by many in Liberia and  in private  even by mediators.	His aides warn an abrupt departure could trigger more bloodshed  a view shared by many in Liberia.
266	2.500926971435547	Four versions of Windows operating systems are targeted: Windows NT  Windows 2000  Windows XP and Windows Server 2003.	The new worm affects these Windows systems: 2000  XP  NT 4.0 and Server 2003.
267	3.218226194381714	A Washington County man may have the countys first human case of West Nile virus  the health department said Friday.	The countys first and only human case of West Nile this year was confirmed by health officials on Sept. 8.
268	2.970214366912842	It was developed with consultation from more than 300 leaders in academia  industry  government and the public.	The plan  called The NIH Roadmap  was developed over 14 months with help from more than 300 consultants in industry and academia.
269	3.399869918823242	"""During the hearing  Morales expressed """"sincere regrets and remorse"""" for his actions."""	"""Morales  who pleaded guilty in July  expressed """"sincere regret and remorse"""" for his crimes."""
270	1.0699183940887451	A black and white dog is running through the grass.	A tan dog is walking through snow.
271	0.18263743817806244	A man is playing guitar.	A boy is talking to a giant dog.
272	2.3620612621307373	You may have to experiment and find what you like.	You have to find out what works for you.
273	2.5177817344665527	A woman peels garlic with her hands.	The woman is slicing herbs.
274	3.4029741287231445	A man is riding a horse by a creek.	A man is riding a horse.
275	1.5239593982696533	You don't have to know.	You don't have to do anything to season it.
276	0.2763404846191406	The flock of sheep are spread out in the field.	A white cat stands on the floor.
277	0.7406778335571289	A yellow school bus parked in a field.	A brown horse in a green field.
278	1.6395676136016846	I'm going to be very direct here.	I'm going to be blunt  here: You don't.
279	1.5434911251068115	Adding aspirin to the water could kill the plant.	Men are trying to remove oil from a body of water.
280	2.848379611968994	A boy skateboards down the railing of some graffiti stairs	A skateboarder slides down a handrail on his feet.
281	5.034146308898926	I expect Japan to keep conducting intervention  but the volume is likely to fall sharply  said Junya Tanase  forex strategist at JP Morgan Chase.	"""Junya Tanase  forex strategist at JP Morgan Chase  said """"I expect Japan to keep conducting intervention  but the volume is likely to fall sharply."""""""
282	1.2125329971313477	A man is playing his guitar at Joe's Cafe.	The man is playing the drums for his mom.
283	0.12585683166980743	A man is erasing a chalk board.	A woman is dancing  and singing.
284	0.1763884723186493	A man sitting cross legged on the grass  with a tree in the background.	Ocean liner close to coast with houses in the background.
285	0.7935802340507507	A woman is dancing.	A woman is playing violin.
286	1.0780937671661377	You don't have to know.	You don't have equipments/facilities to do research in B.
287	1.6892508268356323	It is more deciding what you should do and what you should get others to do.	Point is: know what you want and don't be afraid to ask for it.
288	1.2393498420715332	You need to read a lot to know what you like and what you don't.	You have to decide how much you want to demand  and what unmet demands you can live with.
289	2.1081323623657227	Black and white cow standing near pile of snow.	a black and white cow standing in the field.
290	2.37559175491333	There's not a lot you can do about that.	I really do not think there is much you can do about that.
291	3.1431727409362793	Gillespie sent a letter to CBS President Leslie Moonves asking for a historical review or a disclaimer.	Republican National Committee Chairman Ed Gillespie issued a letter Friday to CBS Television President Leslie Moonves.
292	4.982888221740723	A black dog running into the water.	A black dog running through water.
293	3.8665196895599365	The AFL-CIO is waiting until October to decide if it will endorse a candidate.	The AFL-CIO announced Wednesday that it will decide in October whether to endorse a candidate before the primaries.
294	3.1757097244262695	Three bicyclists crossing a bridge in a city.	The bicyclists are crossing a bridge in the rain.
295	0.2668715715408325	Girl playing in a puddle with her bare feet.	A child is playing with two white and black geese.
296	2.489086627960205	Kodak expects earnings of 5 cents to 25 cents a share in the quarter.	Analysts surveyed by Thomson First Call had expected Kodak to earn 68 cents a share for the quarter.
297	1.9745194911956787	A man is playing a guitar.	A woman is playing the guitar.
298	3.082207441329956	A shirtless woman is operating a lawn mower.	A girl is mowing the grass with a lawn mower.
299	1.6155807971954346	You will want to clean the area first.	You will also want to remove the seeds.
300	1.956647276878357	I was in a similar situation.	Personally when I was in a similar situation I sent the couple a card and a gift.
301	0.8852556943893433	A person is watching people ski down the hill.	The woman is jumping a long distance while people watch.
302	5.054925441741943	Four girls in swimsuits are playing volleyball at the beach.	Four ladies in swimsuits play sand volleyball on the beach.
303	4.793169021606445	You are on the right path.	You're on the right path.
304	2.7264795303344727	It's not a good idea.	Not a good idea.
305	3.1842024326324463	Bremer  61  is a onetime assistant to former Secretaries of State William P. Rogers and Henry Kissinger and was ambassador-at-large for counterterrorism from 1986 to 1989.	Bremer  61  is a former assistant to former Secretaries of State William P. Rogers and Henry Kissinger.
306	4.351619243621826	A girl is coming up on a car.	A girl jumps on top of a car.
307	3.7785189151763916	State health officials said today a young northeast Kansas woman likely has the state's first case of monkeypox among humans or animals.	Health officials confirmed today that a northeast Kansas woman has the state's first case of monkeypox and the first case west of the Mississippi River.
308	0.9668287038803101	You also imply you may not be paid if they cannot place you with a client.	You can do it  but you might not be a professor.
309	2.545579671859741	This is not a good idea.	This sound like a very bad idea.
310	2.701788902282715	It very much depends on the grant in question.	I think it depends very much on the area.
311	3.1072263717651367	Blue couch and twin bed in a living room.	Blue couch in room with sun shining in.
312	3.8655667304992676	A man pours rice into a pot.	A man is putting rice in a bowling pot.
313	3.6215124130249023	A small brown birds is eating from a bird feeder hanging from a tree.	A small bird perches on the bird feeder hanging from the tree.
314	2.153075695037842	Shortly after the opening bell  the Dow Jones Industrial Average was up 11.13 to 9 228.48  while the S&P 500 index gained 1.74 to 982.33.	After a weak start  the Dow Jones Industrial Average ended the day up 26.26 to 9 217.35  while the S&P 500 index rose 3 to 980.59.
315	1.2411009073257446	I think you're looking for Mikey (1992).	I think you're looking for the movie
316	0.5304078459739685	A man is seasoning some carrots.	A woman is slicing garlic.
317	3.755718231201172	Another was in serious condition at Northwest Medical Center in Springdale.	At Northwest Medical Center of Washington County in Springdale  one child is in serious condition.
318	1.391412377357483	The best thing you can do is to know your stuff.	The best thing to do is to overcome the fussiness.
319	0.2151651829481125	A man is bowling.	A kitten is walking.
320	3.3200652599334717	A man and woman sit at a table in a restaurant.	Four women and two men sit at a long table in a restaurant.
321	3.9623918533325195	A bicycle is parked by a shop.	A bicycle is parked outside a bookstore.
322	3.4727437496185303	Two women are dancing and singing in front of a crowd.	The women are singing and dancing.
323	2.5252957344055176	A man attacks a woman.	A man slaps a woman.
324	2.5909361839294434	You are on the right path.	You are right on the mark.
325	2.8115317821502686	On health care  the NDP says there will be no privatization and no health-care premiums.	The New Democrats also renewed their commitment to no health-care privatization and no premiums.
326	4.043325424194336	A dog running on the grass	Two dogs are running on the grass.
327	0.46441155672073364	A woman is spreading mustard on a bread roll.	A kitten is playing with a woman's finger.
328	0.5211438536643982	A man sitting in a back yard playing the guitar.	A man riding on the back of an orange SUV.
329	0.285744309425354	A man is playing a piano.	A guy is peeling a potato.
330	1.2182562351226807	A black and white cow looking through the fence.	A black and white dog looking at the camera.
331	0.8723041415214539	A man in a brown coat rubs his nose.	A bald man with a red beard holds his hand near his mouth.
332	3.467116117477417	Joe Kernan  who had been lieutenant governor for the past seven years  was sworn in as governor after O'Bannon died Saturday.	Kernan  who was O'Bannon's lieutenant governor  friend and political partner  was sworn in six hours after O'Bannon died Saturday.
333	1.6224677562713623	A black dog looking at the camera.	The black and white bull is looking at the camera.
334	0.6952112913131714	A yellow vested person is doing road work.	A person is doing very well on their skateboard.
335	2.433681011199951	You just have to base your answer on what you do know  which is what you want.	Yes  you can do exactly what you want to do.
336	4.522964954376221	He was referring to John S. Reed  the former Citicorp chief executive who became interim chairman and chief executive of the exchange last Sunday .	Next week  John S. Reed  the former Citicorp chief executive who Sunday became interim chairman and chief executive of the exchange  will take up his position.
337	1.4835293292999268	A woman is folding paper.	A woman is applying eye shadow.
338	4.672274112701416	Does this page answer your question?	Does this answer your questions?
339	2.8192594051361084	The 30-year bond US30YT=RR rose 22/32 for a yield of 4.31 percent  versus 4.35 percent at Wednesday's close.	The 30-year bond US30YT=RR grew 1-3/32 for a yield of 4.30 percent  down from 4.35 percent late Wednesday.
340	3.023617744445801	In the US  it will depend on the school.	It really depends on the school and the program.
341	2.565863609313965	In the US  it will depend on the school.	This will depend on the university.
342	3.9404451847076416	An empty office cubicle.	An empty office chair in a cubicle.
343	0.6984317898750305	A man is kicking pots of water.	A man is turning foods.
344	2.920506477355957	A group of people are wearing police uniforms conducting an arrest.	A group of police officers are wearing protection.
345	0.7859158515930176	A man and woman are posing for the camera.	A cat sitting on sand looking up at the camera.
346	3.420374631881714	You answered your own question.	You pretty much answered your own question.
347	3.7482848167419434	Child holding an object that is on fire.	A child in pink holds an object that appears to be on fire.
348	1.1287317276000977	Analysts expected earnings of 27 cents a share on revenue of $17.7 billion  Thomson First Call says.	Hewlett-Packard is putting in for a second-quarter profit of $659 million  or 29 cents a share  on revenue of $18 billion.
349	3.5220887660980225	Knox County Health Department is following national Centers for Disease Control and Prevention Protocol to contain infection.	The health department spokesperson added the department is following Centers for Disease Control protocol.
350	3.375875473022461	A man uses a chainsaw to sculpt a phallic ice sculpture.	A man is using a chainsaw to carve a wooden sculpture.
351	2.6419715881347656	A person filming the outdoors.	There is a couple outdoors.
352	4.417964458465576	A tan puppy on a carpeted floor.	Tan puppy lying down on white carpeting.
353	1.551848292350769	Two dogs play in the grass.	Two tan dogs play in the snow.
354	2.1974363327026367	"""My answer to your question is """"Probably Not""""."""	I think that the short  answer to your question is: No.
355	3.5022330284118652	A human riding a skateboard.	A child is riding a skateboard.
356	3.7494254112243652	Perry has since called two special legislative sessions to try force the redistricting plan through.	Since then  Texas Gov. Rick Perry has called two special sessions trying to push the measure through.
357	0.17621155083179474	A man in a suit dances with a young girl in front of an audience.	A women dangles from a blue fabric connected to a tree.
358	1.5353888273239136	The road is long.	There is nothing on the side of the road.
359	2.9802815914154053	A man is breaking wooden boards with his hand.	A man is breaking tiles with his hands.
360	2.888394594192505	A couple is playing the game of Life.	The family is playing a game together.
361	3.081918478012085	"""Ms Lafferty's lawyer  Thomas Ezzell  told a Kentucky newspaper: """"My understanding of this is that there is a lower percentage of successful impregnations with frozen."""	My understanding of this is that there is a lower percentage of successful impregnations with frozen  Ezzell said.
362	3.6162142753601074	In 1999  the building's owners  the Port Authority of New York and New Jersey  issued guidelines to upgrade the fireproofing to a thickness of 1{ inches.	The NIST discovered that in 1999 the Port Authority issued guidelines to upgrade the fireproofing to a thickness of 1 1/2 inches.
363	1.690517544746399	You are not disclosing key info.	No you are not.
364	1.515764832496643	A man is playing the piano.	A man played the guitar.
365	4.239571571350098	A moped in front of steps of ruins.	A moped in front of ruins.
366	0.332973837852478	A moped in front of ruins.	White bus parked in grass in front of building.
367	1.6899837255477905	The men played follow the leader on the grass.	The rhino grazed on the grass.
368	0.7757558226585388	a little girl is laughing at the camera.	A white cow with big ears looking into the camera.
